[
  {
    "evidence_id": "evidence-m01-33abe24df5cbad28",
    "module": "M01",
    "source_ref": {
      "module": "M01",
      "artifact_path": "data\\acceptance\\frozen-20260910\\integration\\m01\\result.json",
      "artifact_sha256": "e236f49ff1c96489ae2973f31b88270953303bb9ed90182d90d97bbb724b3ac7",
      "record_id": "download-01-d8f9c37a5714",
      "schema_version": "0.1"
    },
    "scope": {
      "type": "input",
      "id": "download-01-d8f9c37a5714"
    },
    "observation": "Input format=pcapng, status=ok, length=1844 bytes.",
    "method": "M01 validated input artifact",
    "limitations": [
      "TShark did not populate frame.file_off; packet source offsets are null."
    ]
  },
  {
    "evidence_id": "evidence-m09-2c7a111907a1d04b",
    "module": "M09",
    "source_ref": {
      "module": "M09",
      "artifact_path": "data\\acceptance\\frozen-20260910\\integration\\m09\\flow_features.json",
      "artifact_sha256": "566e1cfb2ae26b4f945ec02806b9c96b27cfe03df5723a1cacc646a1fecd1b1e",
      "record_id": "download-01-d8f9c37a5714-tcp-flow-0",
      "schema_version": "0.1"
    },
    "scope": {
      "type": "flow",
      "id": "download-01-d8f9c37a5714-tcp-flow-0"
    },
    "observation": "Flow download-01-d8f9c37a5714-tcp-flow-0: 13 packets, 1076 bytes, duration=0.0106697 seconds.",
    "method": "M09 deterministic flow features",
    "limitations": []
  }
]
